{
  "$schema": "https://ivankotov.eu/schemas/public-repositories-v1.schema.json",
  "schema_version": "public-repositories.v1",
  "document_id": "ivankotov-public-repositories-v1",
  "url": "https://ivankotov.eu/public-repositories.json",
  "last_verified": "2026-08-07",
  "owner": "Kot141078",
  "scope": "Public repositories participating in the authored corpus, implementation evidence, literary layer, or public navigation layer.",
  "claim_boundary": "Repository presence is discovery metadata only. It does not establish canonical release status, implementation maturity, external validation, continuity, personhood, consciousness, safety, certification, or deployment authorization.",
  "source_sha256": "5ca6f5d8884c301352cc949147fdb9d0d8974f63f33035be16a997778073e9b2",
  "repository_count": 18,
  "repositories": [
    {
      "name": "advanced-global-intelligence",
      "corpus_class": "research",
      "discovery_role": "primary technical corpus",
      "archived": false,
      "default_branch": "main",
      "observed_head_commit": "98d2a0f763849eaada9bb496c0d1a10cfb91efd9",
      "tracked_files": 953,
      "observed_presence": {
        "readme": true,
        "license": true,
        "citation_cff": true,
        "codemeta": false,
        "zenodo_metadata": false,
        "ro_crate": false,
        "checksums": true,
        "manifest": true,
        "schemas": true
      },
      "repository_id": "github:Kot141078/advanced-global-intelligence",
      "repository_url": "https://github.com/Kot141078/advanced-global-intelligence",
      "observed_commit_url": "https://github.com/Kot141078/advanced-global-intelligence/commit/98d2a0f763849eaada9bb496c0d1a10cfb91efd9",
      "presence_scope": "Observed anywhere in the tracked tree at the stated commit; a true value does not imply a top-level file."
    },
    {
      "name": "ai-social-role-separation-memory-custody",
      "corpus_class": "research",
      "discovery_role": "technical note and custody boundary",
      "archived": false,
      "default_branch": "main",
      "observed_head_commit": "f5d7263181492891032f213c7db1e0c25b701372",
      "tracked_files": 19,
      "observed_presence": {
        "readme": true,
        "license": true,
        "citation_cff": true,
        "codemeta": false,
        "zenodo_metadata": true,
        "ro_crate": false,
        "checksums": true,
        "manifest": true,
        "schemas": true
      },
      "repository_id": "github:Kot141078/ai-social-role-separation-memory-custody",
      "repository_url": "https://github.com/Kot141078/ai-social-role-separation-memory-custody",
      "observed_commit_url": "https://github.com/Kot141078/ai-social-role-separation-memory-custody/commit/f5d7263181492891032f213c7db1e0c25b701372",
      "presence_scope": "Observed anywhere in the tracked tree at the stated commit; a true value does not imply a top-level file."
    },
    {
      "name": "c-governed-cli-agent-mesh",
      "corpus_class": "research",
      "discovery_role": "governed executable-agent protocol package",
      "archived": false,
      "default_branch": "main",
      "observed_head_commit": "c3b004d7439a8c608f08233fc17be1150c442b44",
      "tracked_files": 126,
      "observed_presence": {
        "readme": true,
        "license": true,
        "citation_cff": true,
        "codemeta": false,
        "zenodo_metadata": true,
        "ro_crate": false,
        "checksums": true,
        "manifest": true,
        "schemas": true
      },
      "repository_id": "github:Kot141078/c-governed-cli-agent-mesh",
      "repository_url": "https://github.com/Kot141078/c-governed-cli-agent-mesh",
      "observed_commit_url": "https://github.com/Kot141078/c-governed-cli-agent-mesh/commit/c3b004d7439a8c608f08233fc17be1150c442b44",
      "presence_scope": "Observed anywhere in the tracked tree at the stated commit; a true value does not imply a top-level file."
    },
    {
      "name": "c-hardening-pack",
      "corpus_class": "research",
      "discovery_role": "earlier standalone hardening-package provenance",
      "archived": false,
      "default_branch": "main",
      "observed_head_commit": "9a33e3866cde19939be22a903967bc94f566db76",
      "tracked_files": 42,
      "observed_presence": {
        "readme": true,
        "license": true,
        "citation_cff": true,
        "codemeta": false,
        "zenodo_metadata": true,
        "ro_crate": false,
        "checksums": true,
        "manifest": true,
        "schemas": false
      },
      "repository_id": "github:Kot141078/c-hardening-pack",
      "repository_url": "https://github.com/Kot141078/c-hardening-pack",
      "observed_commit_url": "https://github.com/Kot141078/c-hardening-pack/commit/9a33e3866cde19939be22a903967bc94f566db76",
      "presence_scope": "Observed anywhere in the tracked tree at the stated commit; a true value does not imply a top-level file."
    },
    {
      "name": "cleanroom-arm-p-open-verification",
      "corpus_class": "research_software",
      "discovery_role": "open verification release and fixture plane",
      "archived": false,
      "default_branch": "main",
      "observed_head_commit": "4fc6c29753d039eb0d3ec4decbc1deb258b53751",
      "tracked_files": 446,
      "observed_presence": {
        "readme": true,
        "license": true,
        "citation_cff": true,
        "codemeta": true,
        "zenodo_metadata": true,
        "ro_crate": false,
        "checksums": true,
        "manifest": true,
        "schemas": true
      },
      "repository_id": "github:Kot141078/cleanroom-arm-p-open-verification",
      "repository_url": "https://github.com/Kot141078/cleanroom-arm-p-open-verification",
      "observed_commit_url": "https://github.com/Kot141078/cleanroom-arm-p-open-verification/commit/4fc6c29753d039eb0d3ec4decbc1deb258b53751",
      "presence_scope": "Observed anywhere in the tracked tree at the stated commit; a true value does not imply a top-level file."
    },
    {
      "name": "ester-clean-code",
      "corpus_class": "software",
      "discovery_role": "public implementation substrate",
      "archived": false,
      "default_branch": "main",
      "observed_head_commit": "54cd0c8754587f5e9daf82b16eb84c66a7ac94ef",
      "tracked_files": 3856,
      "observed_presence": {
        "readme": true,
        "license": true,
        "citation_cff": true,
        "codemeta": false,
        "zenodo_metadata": false,
        "ro_crate": false,
        "checksums": true,
        "manifest": true,
        "schemas": true
      },
      "repository_id": "github:Kot141078/ester-clean-code",
      "repository_url": "https://github.com/Kot141078/ester-clean-code",
      "observed_commit_url": "https://github.com/Kot141078/ester-clean-code/commit/54cd0c8754587f5e9daf82b16eb84c66a7ac94ef",
      "presence_scope": "Observed anywhere in the tracked tree at the stated commit; a true value does not imply a top-level file."
    },
    {
      "name": "ester-reality-bound",
      "corpus_class": "research",
      "discovery_role": "L4 Boundary notes, protocol, and evidence routes",
      "archived": false,
      "default_branch": "main",
      "observed_head_commit": "179ccf4558b4cb81ad55317dbe742c47bbbf6a88",
      "tracked_files": 96,
      "observed_presence": {
        "readme": true,
        "license": true,
        "citation_cff": true,
        "codemeta": false,
        "zenodo_metadata": false,
        "ro_crate": false,
        "checksums": true,
        "manifest": false,
        "schemas": true
      },
      "repository_id": "github:Kot141078/ester-reality-bound",
      "repository_url": "https://github.com/Kot141078/ester-reality-bound",
      "observed_commit_url": "https://github.com/Kot141078/ester-reality-bound/commit/179ccf4558b4cb81ad55317dbe742c47bbbf6a88",
      "presence_scope": "Observed anywhere in the tracked tree at the stated commit; a true value does not imply a top-level file."
    },
    {
      "name": "ester-site",
      "corpus_class": "legacy_navigation",
      "discovery_role": "archived legacy site",
      "archived": true,
      "default_branch": "main",
      "observed_head_commit": "3d87989c63fea6167b33ce211d1c3d24c8238ad0",
      "tracked_files": 38,
      "observed_presence": {
        "readme": true,
        "license": true,
        "citation_cff": false,
        "codemeta": false,
        "zenodo_metadata": false,
        "ro_crate": false,
        "checksums": false,
        "manifest": false,
        "schemas": false
      },
      "repository_id": "github:Kot141078/ester-site",
      "repository_url": "https://github.com/Kot141078/ester-site",
      "observed_commit_url": "https://github.com/Kot141078/ester-site/commit/3d87989c63fea6167b33ce211d1c3d24c8238ad0",
      "presence_scope": "Observed anywhere in the tracked tree at the stated commit; a true value does not imply a top-level file."
    },
    {
      "name": "ester-theoretical-core",
      "corpus_class": "research_software",
      "discovery_role": "theoretical core, executable review, and personality-formation evidence",
      "archived": false,
      "default_branch": "main",
      "observed_head_commit": "b3fe82057afc8f9c9734612b5afbc3513d0d5e73",
      "tracked_files": 176,
      "observed_presence": {
        "readme": true,
        "license": true,
        "citation_cff": true,
        "codemeta": true,
        "zenodo_metadata": true,
        "ro_crate": false,
        "checksums": true,
        "manifest": true,
        "schemas": false
      },
      "repository_id": "github:Kot141078/ester-theoretical-core",
      "repository_url": "https://github.com/Kot141078/ester-theoretical-core",
      "observed_commit_url": "https://github.com/Kot141078/ester-theoretical-core/commit/b3fe82057afc8f9c9734612b5afbc3513d0d5e73",
      "presence_scope": "Observed anywhere in the tracked tree at the stated commit; a true value does not imply a top-level file."
    },
    {
      "name": "instrumental-c-public-portfolio",